{"artifact_family":"official_univtac_policy_last","artifact_root":"external/artifacts/act","checkpoint_path":"external/artifacts/act/pull_out_key/univtac/policy_last.ckpt","checkpoint_sha256":"0000000000000000000000000000000000000000000000000000000000000000","config_path":"external/UniVTAC/policy/ACT/train_config_univtac.py","config_sha256":"acdab30e50fa7280918804c4a196f75a6db6e854a3c7a86a0ddd84791c533397","encoder_path":"external/artifacts/act/encoder.pth","encoder_sha256":"0000000000000000000000000000000000000000000000000000000000000000","profile":"univtac","semantic_version":"1.0","source_path":"external/UniVTAC/policy/ACT/act_policy.py","source_sha256":"9e622713ebefa199dc0e80ca8ceb40db61d65162c2d5d753f4776e516d3b3cb1","stats_path":"external/artifacts/act/pull_out_key/univtac/dataset_stats.pkl","stats_sha256":"0000000000000000000000000000000000000000000000000000000000000000","task_id":"pull_out_key","upstream_commit":"05bcd3edb92237107efa40105292a24f1a9fd761","upstream_root":"external/UniVTAC"}
